{
  "context_sha256": "57ba267713dbf345c66de86c12c828ced5a29cf80764a36df08d4453c866f64a",
  "findings": [],
  "outcome": "APPROVE",
  "recorded_at": "2026-08-23T03:05:52Z",
  "review_id": "REV-0001",
  "review_stage": "design",
  "reviewer": "chapter10-design-review",
  "revision": 1,
  "schema_version": "1.0",
  "summary": "The frozen two-phase V2 evidence model fixes the evidence/implementation-review hash cycle by freezing a canonical verification snapshot before implementation review and permitting finalization to add only the current implementation-review reference. It preserves V0/V1 contracts and execution behavior, keeps Chapter 11-owned checks explicit and non-passing in live V2 runs, and provides a bounded scope for verifier context, evidence, review freshness, and Gate integration.",
  "task_id": "TASK-0008"
}
