{
  "context_sha256": "33d2d98fbab8335480909f44bcdbc6d0dcb80fac250e2d50411cf634d1998e49",
  "findings": [],
  "outcome": "APPROVE",
  "recorded_at": "2026-08-27T00:53:16Z",
  "review_id": "REV-0038",
  "review_stage": "implementation",
  "reviewer": "/root/task23_final_review",
  "revision": 1,
  "schema_version": "1.0",
  "summary": "APPROVE。最终独立本地只读审查确认 d51721b..67acd2a 只包含 TASK-0023 治理记录和七个许可业务路径。12.6 五步、CH12-EXIT-01/02、Chapter 12 completion、overall 12/71/378/20/15 与 tracking chapter-12/null/null 一致；Chapter 13 未初始化且 Phase 02 仍 in_progress。H2 current subject 的正式 V1 为 10/10 required checks passed、1507 passed/4 个既有 Windows symlink skips、unverified_scenarios 为空，docs-only diff-cover sentinel 未被夸大。TASK-0022、observe/pre-command、Chapter 11 V2、REC remediation、P2-ESC/P2-HOOK、semantic parity、平台/Hook/free-shell/non-OS-sandbox 边界及 H1 REV-0037 均准确；无提前 code approval、Gate、external merge 或远程完成声明。",
  "task_id": "TASK-0023"
}
