{
  "context_sha256": "d5a758a22fe5077be70f842f1405d3fc785c6240dd3a1984ec2ff2fd316a456f",
  "findings": [],
  "outcome": "APPROVE",
  "recorded_at": "2026-10-13T06:08:39Z",
  "review_id": "REV-0005",
  "review_stage": "implementation",
  "reviewer": "codex-quality-governance-review",
  "revision": 1,
  "schema_version": "1.0",
  "summary": "Independent final governance review rebuilt and verified current context, source and evidence bindings. Native verification passed 2887 tests and all ten required checks; core total is 88.7212492 percent and analysis total is 93.7129841 percent. The same-spec Policy renewal, original events, approvals and runs are retained; thresholds, budgets, scope boundaries and permissions remain intact. RF-001 may be resolved by its confirmed bounded repair. No findings.",
  "task_id": "TASK-0080"
}
