{
  "context_sha256": "8ef9ffd6acfe02f0fc9b7a8578177c360944e9e1c5d1b86b22c8a7b94b9ea15c",
  "findings": [],
  "outcome": "APPROVE",
  "recorded_at": "2026-10-11T05:21:45Z",
  "review_id": "REV-0002",
  "review_stage": "implementation",
  "reviewer": "codex-capabilities-implementation-reviewer",
  "revision": 1,
  "schema_version": "1.0",
  "summary": "独立审核已提交实现并重新读取 native implementation context 与 evidence：subject 为 8b9fa19d64f980b022e74e159c6d04f74a0fe984，evidence canonical SHA256 为 c3cc6f79f2d886ad526398d5e1175e83064dd5f22f8bf31e74d2ab8baf112674，context、规格、Policy 与分类绑定一致。先前预审覆盖的源、测试及治理边界在后续基线合并和绑定提交中未改变；runner 普通执行与回收、其余契约、mutation、Policy、observe/hooks、历史任务读取及常设授权保持。正式原生 V1 日志实际收集并通过全部 1804 项测试，耗时 580.25 秒；10 项 required checks 全部 passed、exit_code 0、无 timeout，diff coverage 为 100%（22 行）。独立从本次 .coverage 通过 coverage API 读取总覆盖率 88.4933%，达到 85% 阈值。此前 repo-local basetemp 重放为 4 failed、1800 passed，strict-full.log 原始失败与诊断记录仍保留；该失败未改写为通过，随后正式验证使用 Git 仓库外临时环境，在同一实现上完整通过。未降低覆盖率、预算、检查集合或其他门禁。无未关闭发现；本结论确认当前绑定实现及本地验证，不宣称远端 required CI 或外部发布已完成。",
  "task_id": "TASK-0076"
}
