{
  "schema_version": "1.0",
  "review_id": "REV-0003",
  "revision": 1,
  "task_id": "TASK-0083",
  "review_stage": "implementation",
  "reviewer": "/root/flow_guidance",
  "recorded_at": "2026-10-21T16:05:50Z",
  "context_sha256": "5e0e1396975f31be4545c32631d8e6fd37176cc5097f6eee6b5dba8aa6cfe7e1",
  "outcome": "APPROVE",
  "summary": "Independent implementation review approves the unchanged subject d917af097353dd592bf60696a9e4e8eb6f1bd680 against the revised frozen specification, recomputed native implementation context and canonical passed evidence digest. The twelve-field allowlist, complete DU/task validation, whole-field replacement, omitted-field preservation, strict UTF-8 JSON handling, original Git/draft eligibility, zero-write preview and ordinary no-op satisfy the bounded contract. Audited apply and equivalent-valid-update recovery bind actor, DU, before/after, original event time and the entire staged task without claiming input-byte or key-set identity. Strict and repairing readers enforce initial materialization until the legal first-classification barrier, including subject-sync recovery; existing explicit escalation, manual reassessment, resolution and reclassification remain usable. Both independently reproduced pre-review defects were fixed before this subject and verified closed. The 116 new in-process cases, companion documentation and existing event-vocabulary assertion are consistent with the implementation. Fresh complete native V1 passed all ten required checks and 3793 tests, with core/analysis total coverage of 89/97 percent and core diff coverage of 97 percent; the earlier failed run and retry remain preserved rather than reinterpreted as success. No open findings remain. Single-writer and uncertain-I/O limits, declaration truth, remote required CI and merge, real scoring, automatic-review arrangement, host connections and both deferred routes retain their documented boundaries; this review grants no execution authority.",
  "findings": []
}
