{
  "schema_version": "1.0",
  "review_id": "REV-0035",
  "revision": 1,
  "task_id": "TASK-0022",
  "review_stage": "implementation",
  "reviewer": "/root/task22_final_review",
  "recorded_at": "2026-08-26T17:08:09Z",
  "context_sha256": "f424e758b3519848b9d0ea68ddf07df81ad9c631bd20869d1aff7085d1538b0b",
  "outcome": "APPROVE",
  "summary": "APPROVE。对投影后 current subject 893ce6bc7f31a20a964776bbbc2b7e5a2c280d90 的最终独立本地只读审查通过。observe 精确协议和 mode/source/actor 封闭组合、CI/dry-run 完整 task 目录零写、apply 的既有审计/幂等/单调升级、source-sensitive digest 与 decision semantic parity 的分离，以及所有有效 observation 的非授权 exit 2 均符合冻结规格。当前 subject 的正式 V1 为 10/10 required checks passed、unverified_scenarios 为空、全量 1507 passed/4 个既有 Windows symlink skips、diff coverage 94%。RF-001 已在 REV-0033-r0002 如实解决，REV-0034 只作为 741790f 投影前 basis；本审核绑定 current context f424e758b3519848b9d0ea68ddf07df81ad9c631bd20869d1aff7085d1538b0b 与 evidence 9054a208781ba61ff65cd03b30fee6e58168a8865c49ee7ebc0e4dc4e723fd58。Chapter 12.5 只完成五步并把 overall 指针移至 12.6；12.6、P2-ESC-01/P2-HOOK-01 与 CH12-EXIT-01/02 均保持 pending。Windows/wrapper 证据不证明 Linux/macOS live Hook；未安装 Hook、IDE/GUI/remote Git、自由 shell 和非 OS sandbox 边界均已明确且未夸大。",
  "findings": []
}
