{
  "context_sha256": "981a528fc8b53a5d6f0e699866e0ecf38ad0b7efcc0dc50d4f2623cb329fd602",
  "findings": [],
  "outcome": "APPROVE",
  "recorded_at": "2026-08-22T16:54:25.315664Z",
  "review_id": "REV-0002",
  "review_stage": "design",
  "reviewer": "chapter9-policy-review",
  "revision": 1,
  "schema_version": "1.0",
  "summary": "Fresh independent design review approved the 2.0.0 Policy, strict V2 prefix and checks, legacy V0/V1 compatibility, route-independent selection, versioned contracts, execution refusal boundary, scope, and completed policy_changed governance chain.",
  "task_id": "TASK-0006"
}
