{
  "schema_version": "1.0",
  "review_id": "REV-0005",
  "revision": 1,
  "task_id": "TASK-0015",
  "review_stage": "design",
  "reviewer": "/reviewer",
  "recorded_at": "2026-08-25T11:48:46Z",
  "context_sha256": "e7e398673f2e7f9b5372704575a8779fcbd61557cc61d290fe415fc1a5b18d67",
  "outcome": "APPROVE",
  "summary": "APPROVE. The only r5 scope addition is `.ai/templates/evidence-v2.json`; it is a necessary non-authoritative schema fixture because `tests/unit/test_contracts.py` validates that template against the V2 evidence contract, whose targeted_mutation object now requires artifact identity and five-item projection fields. The spec expressly limits the template to contract synchronization and preserves all runner, action-approval, and forbidden-action boundaries; it adds neither executable behavior nor authority. Current spec SHA (f4bbf491...), subject/base (17ab98cf...), Policy SHA (f4854d...), and classification input SHA (7616183e...) match the r5 context, and `aiflow validate TASK-0015` passes. Earlier design findings remain resolved; no new blocker was found.",
  "findings": []
}
