{
  "context_sha256": "af44ee3556b362d0daba80997902e7ff7829bcf702ac2a9b19fce1805da8eb28",
  "findings": [
    {
      "evidence_refs": [
        ".ai/tasks/TASK-0012/spec.md#范围",
        ".ai/schemas/mutation-manifest.schema.json:12-16",
        "src/aiflow/mutation_manifest.py:121-181"
      ],
      "finding_id": "RF-001",
      "location": {
        "line": 14,
        "path": ".ai/schemas/mutation-manifest.schema.json"
      },
      "resolution": {
        "actor": "codex",
        "reason": "Schema now requires exactly five items and the loader compares the complete ordered seven-field declarations with the frozen canonical tuple; four, six, reordered, or drifted manifests are rejected by regression tests.",
        "resolved_at": "2026-08-23T16:02:53Z"
      },
      "severity": "high",
      "status": "resolved",
      "title": "Loader accepts fewer than the five frozen safeguards"
    },
    {
      "evidence_refs": [
        ".ai/tasks/TASK-0012/spec.md#验收条件",
        "src/aiflow/mutation_manifest.py:121-128",
        "src/aiflow/contracts.py:62-72"
      ],
      "finding_id": "RF-002",
      "location": {
        "line": 126,
        "path": "src/aiflow/mutation_manifest.py"
      },
      "severity": "high",
      "status": "open",
      "title": "Schema directory symlink can escape the repository"
    },
    {
      "evidence_refs": [
        ".ai/tasks/TASK-0012/spec.md:17",
        "src/aiflow/contracts.py:174-193"
      ],
      "finding_id": "RF-003",
      "location": {
        "line": 174,
        "path": "src/aiflow/contracts.py"
      },
      "severity": "high",
      "status": "open",
      "title": "Public contract APIs accept arbitrary schema directories"
    },
    {
      "evidence_refs": [
        ".ai/tasks/TASK-0012/spec.md#错误行为",
        "src/aiflow/mutation_manifest.py:50-58"
      ],
      "finding_id": "RF-004",
      "location": {
        "line": 50,
        "path": "src/aiflow/mutation_manifest.py"
      },
      "severity": "medium",
      "status": "open",
      "title": "Duplicate JSON object keys are silently overwritten"
    }
  ],
  "outcome": "REQUEST_CHANGES",
  "recorded_at": "2026-08-23T16:02:53Z",
  "review_id": "REV-0003",
  "review_stage": "implementation",
  "reviewer": "task0012-independent-implementation-reviewer",
  "revision": 2,
  "schema_version": "1.0",
  "summary": "Implementation review blocks approval: the loader does not enforce the frozen exact five-entry manifest, repository-bound schema containment is incomplete, public contract validation was expanded to arbitrary schema directories, and duplicate JSON keys remain ambiguous.",
  "task_id": "TASK-0012"
}
