{
  "context_sha256": "6bb1dde030ecf2ccd6bf2f1c1af73a4a5a3ce21112c4235be6c7190c71c22dad",
  "findings": [
    {
      "evidence_refs": [
        "tests/integration/test_begin_close_commands.py:33-84",
        ".ai/tasks/TASK-0056/spec.md:50",
        ".ai/tasks/TASK-0056/spec.md:70",
        ".ai/tasks/TASK-0056/logs/run-20261001T034050926490Z/evidence.json"
      ],
      "finding_id": "RF-001",
      "location": {
        "line": 46,
        "path": "tests/integration/test_begin_close_commands.py"
      },
      "severity": "medium",
      "status": "open",
      "title": "成功spawn后非超时异常跳过原直接子进程清理；须保持首次异常并有界回收实际retained进程，再验证新subject"
    }
  ],
  "outcome": "REQUEST_CHANGES",
  "recorded_at": "2026-10-01T04:39:31Z",
  "review_id": "REV-0009",
  "review_stage": "implementation",
  "reviewer": "e4-task56-independent-implementation-reviewer",
  "revision": 1,
  "schema_version": "1.0",
  "summary": "独立审查 base 至 subject 的累计24个源码、测试和文档路径，并核对当前原生V2证据、14项必需检查、5个killed mutation和verification snapshot。旧源码成功spawn后的非超时异常没有保留原直接子进程清理，违反冻结规格的helper兼容及owned cleanup要求，RF-001为medium open，须修复并对新subject实际验证后重新审查。现有测试全通过不覆盖此回退；私有004仅获静态准入，尚未实际执行，不视为RF-001已解决。未保留后代仍为unknown，不作全树终态声明。",
  "task_id": "TASK-0056"
}
