{
  "context_sha256": "8e93b5c56d2226ab028e64efa14652bb0391b3560f96cd139e2f404af7d33299",
  "findings": [],
  "outcome": "APPROVE",
  "recorded_at": "2026-10-01T10:44:12Z",
  "review_id": "REV-0001",
  "review_stage": "design",
  "reviewer": "task57-independent-reviewer-verifier",
  "revision": 1,
  "schema_version": "1.0",
  "summary": "Actual independent nonauthor review approves the frozen corrective design for CUMULATIVE-P2-001. The finite qualification covers Loader MRO/namespaces, callable code/default/closure state, actual global/builtin and selected dependency dispatch, supported mutable content and Hashable's own registration; unknown/custom/failed or bounded qualification falls back to current safe_load without arbitrary Python authenticity or concurrent-configuration atomicity claims. Both real stale-result counterexamples are required black-box regressions. The private fourteen-probe prototype is preparation only; production must still implement separate 4096-object/depth64/cycle limits and binascii.Error namespace coverage. Preserve all old named tests, standard cache hits/current file and validation behavior, original full V2 checks/deadlines/thresholds/fixed mutations, actual independent verification and later implementation review. No source completion, verification pass, publication or real-report import is inferred from this design approval.",
  "task_id": "TASK-0057"
}
