{
  "context_sha256": "896fb1c4eacb13600a1fa27790f057e8cac48945b18cbf4e8d839d863c6994c6",
  "findings": [
    {
      "evidence_refs": [
        ".ai/tasks/TASK-0012/spec.md#错误行为",
        "src/aiflow/mutation_manifest.py:212-218",
        "src/aiflow/contracts.py:48-59"
      ],
      "finding_id": "RF-001",
      "location": {
        "line": 218,
        "path": "src/aiflow/mutation_manifest.py"
      },
      "resolution": {
        "actor": "codex",
        "reason": "Normalized malformed and unusable repository-owned schema failures to MUTATION_MANIFEST_READ_FAILED while preserving ContractValidationError; added regressions for malformed JSON and an unresolvable schema reference, independently re-reviewed with focused suites passing.",
        "resolved_at": "2026-08-23T16:19:42Z"
      },
      "severity": "medium",
      "status": "resolved",
      "title": "Malformed mutation schema JSON bypasses the manifest reason-code contract"
    }
  ],
  "outcome": "REQUEST_CHANGES",
  "recorded_at": "2026-08-23T16:19:42Z",
  "review_id": "REV-0004",
  "review_stage": "implementation",
  "reviewer": "task0012-independent-security-reviewer",
  "revision": 2,
  "schema_version": "1.0",
  "summary": "Security re-review confirms the four REV-0003 findings are closed but blocks final approval because malformed repository-owned mutation schema JSON escapes as a raw JSONDecodeError instead of the frozen MUTATION_MANIFEST_READ_FAILED reason code.",
  "task_id": "TASK-0012"
}
