{
  "schema_version": "1.0",
  "review_id": "REV-0001",
  "revision": 1,
  "task_id": "TASK-0081",
  "review_stage": "design",
  "reviewer": "/root/historical_evidence_rules",
  "recorded_at": "2026-10-14T13:14:30Z",
  "context_sha256": "bdce6ec5d2460693be5a4b62f8b64642a6f309424efb50b303b942555b81d135",
  "outcome": "APPROVE",
  "summary": "Independent design review of the frozen TASK-0081 specification e60c722d4de75c35d670f540709ec4f33cd5e1e4099c52ea4729e4e741e51d41, native REVIEW/V0 classification input 3875105cbba20cfff763ea519e9f091eddaf525ac48881c43e95a70960c228ca, and unchanged subject 734cb108f6416a4bce04a4fcee879d586a1f2cbe. No blocking design finding. The owner-authorized scope is the exact 19 ignored local roots, 16 old metadata files and enumerated derived rehearsal material; original primary-checkout AI Flow tasks/logs, private evidence, owner drafts, primary virtual environment, pre-existing refs and archive tags remain protected. Unique random fixture state is honestly treated as irreversible with verified backup rather than assumed reproducible. The admitted gzip recovery chain preserves all 255377 entries from 18 roots, including nested publication Git metadata and unique files, using an independently source-hashed inventory, write-time source hashing, complete sequential archive readback and an actual complete restoration with independent no-follow byte/topology comparison. The independently retained primary ruff source covers the sole excluded duplicate executable. I freshly checked the frozen specification hash, all 14 preflight artifact bindings, the primary gzip archive hash, final preflight receipt hash and ruff source/target hash equality. The preflight records 255394 original deletion entries, 956575010 logical bytes, 8751 protected entries, 57 original refs and 1851 preserved execution entries; the design rechecks current inventory and these protection conditions at execution. The conservative failure-and-provenance package covers the identified ct1, construction, full-run, contracts, timeout/sentinel, generated Task79 and publication evidence; it is correctly not described as a minimal reproduction set. First clean-clone fixture provenance, absent raw console, prior source-topology/xz/readback/copy anomaly causes, ACL equivalence, directory-time equivalence and historical execution remain explicitly unknown or uncertified. Original failed candidates, failed-copy bytes, diagnostics and append-only historical facts are retained. Bounded original-location recovery, absent-root and reparse-ancestor guards, bottom-up non-recursive unlink/rmdir, exact helper/plan/receipt hashes, finite-lived single-use delete action and unchanged subject binding provide the required deletion boundaries. This approves only the frozen design: separate native spec and delete action approvals, current bindings, protected postflight, unchanged native verification, independent implementation review, code approval/Gate and required CI remain necessary; it does not certify deletion, historical replay, publication or provider execution.",
  "findings": []
}
