{
  "context_sha256": "7e1d2328a667c36c5d4404d966bdeddcab717463a99553f91da0c58a8747a189",
  "findings": [],
  "outcome": "APPROVE",
  "recorded_at": "2026-10-24T07:22:27.937084Z",
  "review_id": "REV-0002",
  "review_stage": "implementation",
  "reviewer": "/root/sdk_design_review",
  "revision": 1,
  "schema_version": "1.0",
  "summary": "Independent formal implementation review approves fixed subject df4bdb7391e54d06d1eeb2ec28ac738b61765032 against base f845b436bdba52cdc8d27ebec2c8b78faecca988 and the unchanged frozen TASK-0087 specification. The supplied native context was independently canonical-hashed and rebuilt identically; its evidence reference exactly equals the independently recomputed canonical evidence hash efb5f05142c3aec2873fc6520f4be77ae96a1a0f9311f6e45c83c3e30b91f904. Current source, tests and companion documentation match the fixed subject; the later HEAD 854b9e815cf3a3b79d1629a886f21e28d6d092cd changes only this task governance synchronization. Native status remains WAITING_FOR_FINAL_REVIEW with fresh classification and passed evidence. The default context path does not import the SDK runner. Explicit activation is restricted to the implementation stage with required documents, reference documents, question and unused ignored output. Before input preparation and again before execution, native status, context validation and full context recomputation bind repository, task, base, subject and fresh evidence without substituting observed HEAD. Selected candidate material is restricted to explicit changed docs paths and the existing fixed ordinary Git-blob preparation. The extracted execute_review block is shared by both real callers; AST comparison confirms prepare_request, validate_report and the actual _run_sdk transport, permissions and lifecycle worker are unchanged. The extraction preserves standalone preview and stdout, output reservation, inherited-instruction hash handling, validated reports, interruption and bounded cancellation/close semantics. Supplement status uses stderr, completed REQUEST_CHANGES remains that outcome, and failed/unknown or exceptional execution retains safe receipts without retry or output reuse. The supplement contains no formal review, approval, finding resolution or task-transition call; real Git/context tests assert native task-file bytes are unchanged. Trigger binding is limited to three supplied application fields and creates no identity or authority. The earlier pre-review test gap is closed by a regression that changes the context only after input preparation and verifies rejection without dispatch. The 35 real Git/context cases use fake execution, covering default/no-import, invalid and stale inputs, wrong bindings, fixed candidate despite a governance HEAD tail, both freshness stages, output failure and reuse, negative conclusions and failure/unknown behavior. Preserved logs show 147 affected tests passing in the native reduced environment, including all 112 SDK regressions, and complete native V1 with all ten checks passed and 4005 tests in 949.94 seconds. Coverage logs show core/analysis totals of 89/97 percent and all 74 changed executable lines covered; fixed-subject whitespace validation and the eight-section review-package validation also pass. Original red evidence is preserved. No new abstraction, module, dependency, configuration, formatter, queue, security-access expansion or platform is introduced. Read-only limitations, unknown complete model context/identity/cost, per-invocation rather than global once semantics and snapshot freshness limits remain explicit. This approval covers local implementation and simulated verification only; it does not certify real SDK activation, remote CI or publication. No real SDK turn or external action was performed in this review, and push, PR, merge, deployment and new real calls remain outside the present authorization. Local Gate is a subsequent native step. No open findings remain.",
  "task_id": "TASK-0087"
}
